0,1,2,3,4,5,correct,choiceA_probs,choiceB_probs,choiceC_probs,choiceD_probs
A lesion causing compression of the facial nerve at the stylomastoid foramen will cause ipsilateral,paralysis of the facial muscles.,paralysis of the facial muscles and loss of taste.,"paralysis of the facial muscles, loss of taste and lacrimation.","paralysis of the facial muscles, loss of taste, lacrimation and decreased salivation.",A,False,0.249999999996362,0.249999999996362,0.25000190735227074,0.24999809265500517
"A ""dished face"" profile is often associated with",a protruding mandible due to reactivation of the condylar cartilage by acromegaly.,a recessive maxilla due to failure of elongation of the cranial base.,an enlarged frontal bone due to hydrocephaly.,defective development of the maxillary air sinus.,B,False,0.250006198773004,0.2499947546593868,0.25001192102626685,0.24998712554134234
Which of the following best describes the structure that collects urine in the body?,Bladder,Kidney,Ureter,Urethra,A,False,0.2499942767090553,0.25002765677429795,0.24996090110023472,0.250017165416412
Which of the following structures is derived from ectomesenchyme?,Motor neurons,Skeletal muscles,Melanocytes,Sweat glands,C,True,0.24997114468982118,0.24990917069779062,0.25007415084512874,0.25004553376725935
Which of the following describes the cluster of blood capillaries found in each nephron in the kidney?,Afferent arteriole,Glomerulus,Loop of Henle,Renal pelvis,B,False,0.24998760055052535,0.2500190722229263,0.24995517933452907,0.25003814789201934
A patient suffers a broken neck with damage to the spinal cord at the level of the sixth cervical vertebra.,They will be unable to breathe without life support.,They will only be able to breathe quietly.,It is impossible to predict an effect on breathing.,Breathing will be unaffected.,B,False,0.24999999998544808,0.24999618531728635,0.24999999998544808,0.2500038147118175
Which of the following anatomical regions of abdomen lies just distal to the sternum?,Epigastric,Hypochondriac,Hypogastric,Lumbar,A,False,0.24999689631989624,0.2500732009606127,0.2499835454017321,0.24994635731775897
Which of the following best describes the human body's defense mechanism against environmental bacteria?,Hair in the nose,Mucous membranes,Osteoblasts,Saliva,B,False,0.2500181202476561,0.24999427779857908,0.24999237050087897,0.24999523145288596
The palatine processes begin to fuse at,six weeks post-fertilization.,eight weeks post-fertilization.,ten weeks post-fertilization.,twelve weeks post-fertilization.,C,False,0.25001192104081893,0.25000619878755576,0.24999094008581266,0.24999094008581266
Primary motor cortex activity results in,bilateral contraction of antigravity limb muscles.,bilateral contraction of limb musculature.,contraction of ipsilateral limb musculature.,contraction of contralateral limb musculature.,D,True,0.24999618527726908,0.2500019073013386,0.2499942779650161,0.2500076294563763
You notice that your patient's submandibular lymph nodes are enlarged. You would look for potential infection sites in the,hard palate.,hard palate and upper lip.,"hard palate, upper lip and upper central incisor.","hard palate, upper lip, upper central incisor and lower first molar.",D,False,0.24999427793136542,0.2500095368368407,0.24999332428069593,0.25000286095109786
A patient suffers damage to the orbit in a road traffic incident resulting in damage to the third cranial nerve. Which of the following signs will be present?,Pupillary constriction and a medial strabismus,Pupillary dilatation and a medial strabismus,Pupillary constriction and a lateral strabismus,Pupillary dilatation and a lateral strabismus,D,False,0.24999523165388393,0.25000286101931113,0.24999904630749384,0.25000286101931113
Which of the following statements is true of the temporomandibular joint?,It has an articular disc of hyaline cartilage,Its articular surfaces are covered by hyaline cartilage,Proprioceptive information is carried by the chorda tympani and deep temporal nerves,Proprioceptive information is carried by the masseteric and auriculotemporal nerves.,D,False,0.25002478835694525,0.2500715273999917,0.25000857481177374,0.2498951094312894
Laryngoscopic examination of the vocal folds after suspected recurrent laryngeal nerve damage usually shows that the vocal fold on the injured side is tensed and in an intermediate position between adduction and abduction. This is because,cricothyroid muscle is still functional but the interarytenoid muscles are fully active.,cricothyroid muscle is still functional but the interarytenoids are weak.,cricothyroid muscle is paralyzed but the interarytenoids are fully active.,cricothyroid muscle is paralyzed but the interarytenoids are weak.,B,False,0.24999809250585006,0.25000572195858484,0.2500095367722653,0.24998664876329982
Which one of the following statements about the growth of the mandible is correct?,The mental symphysis closes at about 1 year postnatally,The condylar growth cartilage ceases activity at puberty,The ossification centre appears about 8 weeks I.U.L medial to Meckel's cartilage,The functional matrix acting on the angle of the mandible is the lateral pterygoid muscle,A,False,0.24999475453410142,0.24998807904308343,0.24999618501965387,0.2500209814031613
Which of the following statements is true of the pupillary light reflex?,Its efferent limb is carried in the optic nerve,It is mediated by the inferior colliculi in the midbrain,It is a consensual reflex,Its afferent limb is carried in the oculomotor nerve,C,False,0.2500114433468832,0.25002861085972383,0.24996852972167563,0.24999141607171732
Which muscles are normally active during quiet inspiration?,External and internal intercostal muscles,External intercostal muscles and diaphragm,Internal intercostal muscles and diaphragm,External and internal intercostal muscles and diaphragm,B,False,0.25004863998865573,0.25000428943865766,0.24998903085344837,0.2499580397192382
Male hormones are produced by which of the following?,Glans penis,Prepuce,Prostate,Testes,D,True,0.2499918937382994,0.2499995230018599,0.24999380103236207,0.25001478222747864
Oxygenated blood is carried to the heart by which of the following structures?,Aorta,Carotid arteries,Inferior vena cava,Pulmonary veins,D,True,0.2500128739074573,0.24998426384177563,0.24997282073223692,0.2500300415185301
Which of the following allows air to pass into the lungs?,Aorta,Esophagus,Trachea,Pancreas,C,False,0.2500641390000866,0.249984976257053,0.24994302062997134,0.2500078641128889
Where is the sinoatrial node located?,Between the left atrium and the left ventricle,Between the right atrium and the right ventricle,In the upper wall of the right atrium,In the upper wall of the left ventricle,C,False,0.2499961852436184,0.2500038146381473,0.24999141699027083,0.2500085831279635
"In relation to the rib, the corresponding intercostal nerve lies",deep to its superior border.,superficial to its superior border.,deep to its inferior border.,superficial to its inferior border.,C,False,0.25001454318110317,0.25001740438685777,0.2500002376434782,0.2499678147885609
The regional lymphatic drainage of the left side of the tip of the tongue is to the,left submental lymph node.,left and right submental lymph nodes.,left submandibular lymph node.,left and right submandibular lymph nodes.,B,False,0.25003457207794844,0.24998593269336802,0.250004052142426,0.2499754430862575
Gastrulation is the process of,mesoderm formation and occurs after neurulation.,ectomesenchyme formation and occurs before neurulation.,mesoderm formation and occurs before neurulation.,ectomesenchyme formation and occurs after neurulation.,B,False,0.2500014305032891,0.2500014305032891,0.2500014305032891,0.24999570849013256
The spheno-occipital synchondrosis,is a secondary growth cartilage.,influences the position of the viscerocranium.,ceases activity at 7 years of age.,can be reactivated in patients affected by acromegaly.,B,False,0.25000047681442084,0.25000047681442084,0.24999475482309222,0.2500042915480661
Which of the following substances is found in greater quantity in exhaled air?,Carbon dioxide,Carbon monoxide,Nitrogen,Oxygen,C,False,0.24994016066202018,0.24998402302848818,0.2500288468749666,0.250046969434525
Which of the following conditions is characterized by the presence of kidney stones (renal calculi)?,Glomerulonephritis,Interstitial nephritis,Nephrolithiasis,Polycystic kidney,C,False,0.250026463042986,0.2500464931258296,0.2499711501968983,0.24995589363428614
A pulse may be felt on a patient's face where the,facial artery crosses the mandible.,facial artery crosses the maxilla.,superficial temporal artery crosses the maxilla.,superficial temporal artery crosses the orbital rim.,A,False,0.2499890328899722,0.2500081062671586,0.2500023841012077,0.2500004767416616
A patient sustains severe blunt trauma to the left upper abdomen and requires surgery. Which one of the following organs is most likely to be involved?,Appendix,Gallbladder,Spleen,Urinary bladder,C,False,0.25001001362306546,0.24998712557044506,0.25000619880210895,0.24999666200438048
Which statement concerning the atrioventricular bundle is correct?,It is formed of autonomic nerve processes and is the only electrical connection between the atria and the ventricles.,It is formed of Purkinje fibres and is the only electrical connection between the atria and the ventricles,It is formed of autonomic nerve processes and forms one of several electrical connections between the atria and ventricles.,It is formed of Purkinje fibres and forms one of several electrical connections between the atria and ventricles.,B,False,0.24999856921477187,0.25000810608525603,0.2500119209353156,0.24998140376465647
Which of the following terms describes the motion of bending the forearm toward the body?,Abduction,Eversion,Flexion,Pronation,C,False,0.2499842638190336,0.2500329028789037,0.25000905902011233,0.2499737742819504
Food is prevented from entering the larynx during the pharyngeal phase of swallowing by,constriction of the laryngeal entrance.,upward movement of the epiglottis.,downward movement of the larynx.,increase in respiratory rate.,A,False,0.24999666213898328,0.2500023841739674,0.2500042915480661,0.24999666213898328
At which of the following locations does bile enter the digestive tract?,Gastroesophageal sphincter,Duodenum,Ileocecum,Jejunum,B,False,0.2500140667923386,0.24999690027812557,0.24998164214390114,0.2500073907856346
In which of the following positions does a patient lie face down?,Dorsal,Erect,Lateral,Prone,B,False,0.25000214557598843,0.24999642354646534,0.25001454375592,0.2499868871216262
Complete bilateral cleft palate is due to failure of fusion of the,palatine processes.,palatine and frontonasal processes.,"palatine, frontonasal and secondary nasal processes.","palatine, frontonasal, secondary nasal processes and mandibular processes.",C,True,0.24999618522633826,0.24999046333323519,0.2500095368195599,0.2500038146208666
The auditory tube,connects the inner ear and nasopharynx.,is derived from the second pharyngeal pouch.,is opened by the action of levator veli palatini.,is closed by the action of tensor veli palatini.,C,False,0.2500052452405724,0.24999952314010443,0.24999570847921876,0.24999952314010443
Which of the following is the lymphoid organ that is a reservoir for red blood cells and filters organisms from the blood?,Appendix,Gallbladder,Pancreas,Spleen,D,False,0.2499575638494711,0.2500071514141463,0.25002050359304123,0.25001478114334125
Which of the following cavities are separated by the diaphragm?,Abdominal and pelvic,Cranial and spinal,Thoracic and abdominal,Pericardial and pleural,C,False,0.2500915632356958,0.2499418263738525,0.2499933181068437,0.24997329228360804
The walls of bronchioles contain,"cartilage, smooth muscle and respiratory epithelium.",cartilage and smooth muscle.,cartilage and respiratory epithelium.,smooth muscle and respiratory epithelium.,D,True,0.2499918937919587,0.24999761571780277,0.24999856938484283,0.25001192110539566
"Which of the following organs removes bilirubin from the blood, manufactures plasma proteins, and is involved with the production of prothrombin and fibrinogen?",Gallbladder,Kidney,Liver,Spleen,C,False,0.249929191893088,0.2500760592760255,0.24994826070459447,0.25004648812629215
Which of the following conditions is characterized by incompetence of the esophageal sphincter?,Crohn's disease,Esophageal varices,Gastroesophageal reflux disease,Pyloric stenosis,C,False,0.24999260763780012,0.24996113929668407,0.2500097738572508,0.250036479208265
The muscles of the soft palate are innervated by branches of the,trigeminal and glossopharyngeal nerves.,facial and glossopharyngeal nerves.,trigeminal and vagus nerves.,facial and vagus nerves.,C,True,0.2500028609574653,0.25000095359428115,0.25000667572748997,0.24998950972076364
Which of the following is the large bone found superior to the patella and inferior to the ischium?,Calcaneus,Femur,Symphysis pubis,Tibia,B,True,0.24993968485242454,0.25003123226054075,0.2500121571190484,0.2500169257679863
A successful inferior alveolar nerve block will produce anaesthesia of the,lower lip.,lower lip and mandibular teeth.,"lower lip, mandibular teeth and labial gingivae of the anterior mandibular teeth.","lower lip, mandibular teeth and labial gingivae of the anterior and buccal gingivae of the posterior mandibular teeth.",C,False,0.2499966621498971,0.25000238418488147,0.24999856948034002,0.25000238418488147
The mucosa of the upper larynx is innervated by the,internal laryngeal nerve which is the afferent limb of the cough reflex.,external laryngeal nerve which is the afferent limb of the gag reflex.,internal laryngeal nerve which is the afferent limb of the gag reflex.,external laryngeal nerve which is the afferent limb of the cough reflex.,A,True,0.2500097748504636,0.2499725828645419,0.2500097748504636,0.25000786743453085
The bones of the viscerocranium develop initially by,endochondral ossification and follow the somatic growth pattern.,endochondral ossification and follow the neural growth pattern.,intramembranous ossification and follow the somatic growth pattern.,intramembranous ossification and follow the neural growth pattern.,C,False,0.2500002382455491,0.25000977517970296,0.2500050066671504,0.24998497990759752
The physician directs the medical assistant to complete a request form for an X-ray study of the fibula. The procedure will be performed on which of the following structures?,Heel,Lower leg,Toes,Thigh,B,False,0.25000429153351394,0.2499947548085406,0.24999666212443158,0.25000429153351394
Which cells in the blood do not have a nucleus?,Lymphocyte,Monocyte,Erythrocyte,Basophil,C,True,0.24999523162478055,0.24999523162478055,0.250006675760232,0.25000286099020685
The coronal suture joins the,frontal and parietal bones.,left and right parietal bones.,parietal and occipital bones.,"parietal, squamous temporal and greater wing of the sphenoid.",A,False,0.2500014304996511,0.24999570848649463,0.24999952314738044,0.2500033378664738
"If you run your finger down the anterior midline of a patient's extended neck from chin to sternal notch, you should be able to palpate, in order, the","hyoid bone, cricoid cartilage, thyroid cartilage.","thyroid cartilage, cricoid cartilage, hyoid bone.","hyoid bone, thyroid cartilage, cricoid cartilage.","thyroid cartilage, hyoid bone, cricoids cartilage.",C,True,0.24998998653882254,0.2500033378009897,0.2500071525782905,0.24999952308189732
Which of the following bony structures may be palpated in a live patient?,The supraorbital foramen,The infraorbital foramen,The mental foramen,All of the above,D,False,0.25000118472756616,0.24991346166887243,0.25008512255301213,0.25000023105054936
Which of the following structures accompany the oesophagus through the diaphragm?,The phrenic nerves,The splanchnic nerves,The sympathetic trunks,The vagus nerves,D,False,0.2500610367971581,0.24992657205421454,0.2500410055492873,0.24997138559934007
Which sequence describes the systemic circulation?,Left ventricle → aorta → arteries → veins → capillaries,Left ventricle → aorta → arteries →capillaries → veins,Right ventricle → pulmonary trunk → arteries → capillaries →veins,Right ventricle → pulmonary trunk → arteries → veins → capillaries,B,False,0.25001239795164837,0.2500009535542618,0.24999332424704493,0.24999332424704493
The anatomic location of the spinal canal is,caudal,dorsal,frontal,transverse,B,False,0.25000333785919776,0.24999570847921881,0.24999761580238578,0.25000333785919776
The parotid duct runs,deep to masseter and enters the mouth opposite the upper second molar.,superficial to masseter and enters the mouth opposite the upper second molar.,deep to masseter and enters the mouth opposite the upper second premolar.,superficial to masseter and enters the mouth opposite the upper second premolar.,B,True,0.24998855603553488,0.2500095367904553,0.2500057219767746,0.2499961851972352
"If the foot is abducted, it is moved in which direction?",Inward,Outward,Upward,Downward,D,False,0.2499985694585122,0.25000619892580267,0.24999475481217845,0.2500004768035068
The infraorbital nerve,is a terminal branch of the maxillary division of the trigeminal nerve.,is a terminal branch of the maxillary branch of the facial nerve.,carries parasympathetic secretomotor neurons to the lacrimal gland.,innervates the inferior part of the orbicularis oculi muscle.,A,False,0.2499948738922638,0.2499915361228794,0.24999868854041463,0.2500149014444421
Which of the following best describes the process whereby the stomach muscles contract to propel food through the digestive tract?,Absorption,Emulsion,Peristalsis,Regurgitation,C,False,0.24998973975398733,0.24990678725945956,0.2500145354982079,0.25008893748834526
Which of the following is the point at which an impulse is transmitted from one neuron to another neuron?,Dendrite,Glial cell,Nerve center,Synapse,D,False,0.24996543076103087,0.2500245573844144,0.25000834385422094,0.2500016680003338
Which of the following muscles initiates elevation of the mandible?,Masseter,Temporalis,Lateral pterygoid,Medial pterygoid.,D,False,0.24999475405822172,0.2500281341872016,0.25000429078316644,0.2499728209714101
Which of the following is an accessory organ of the gastrointestinal system that is responsible for secreting insulin?,Adrenal gland,Gallbladder,Liver,Pancreas,D,False,0.24995827903221843,0.25001835770646413,0.2500164502250496,0.2500069130362678
A malignant tumour is damaging the patient's glossopharyngeal nerve. They will experience,loss of taste over the anterior two-thirds of the tongue.,loss of somaesthetic sensation over the anterior two thirds of the tongue.,loss of taste and somaesthetic sensation over the posterior third of the tongue.,paralysis of the muscles of the tongue.,C,True,0.24999856921204058,0.2500014302349866,0.25001668957701717,0.2499833109759556
A possible effect of damage to the third cranial nerve by trauma to the orbit is,a convergent strabismus.,ptosis.,pupillary contriction.,bitemporal hemianopia.,B,False,0.2500042915553421,0.25000047682169674,0.2499966621462591,0.24999856947670202
Blood flows from the right ventricle of the heart into which of the following structures?,Inferior vena cava,Left ventricle,Pulmonary arteries,Pulmonary veins,C,True,0.24999761578419605,0.25000333784100764,0.2500052452223822,0.2499938011524141
A patient is stabbed in the neck. You suspect damage to the accessory nerve in the posterior triangle. You would test nerve function by asking the patient to,extend their neck against resistance.,extend their neck without impairment.,lift their shoulders against resistance.,lift their shoulders without impairment.,C,True,0.2500023841557773,0.2499966621207936,0.2500061989185265,0.24999475480490263
Which of the following muscles are derived from the first brachial arch?,The muscles of mastication,The muscles of mastication and anterior belly of digastric,The muscles of mastication and anterior and posterior bellies of digastric,"The muscles of mastication, anterior and posterior bellies of digastric and geniohyoid",B,False,0.249954463082846,0.24996781244780525,0.2500317085654458,0.2500460159039029
Which of the following best describes the location where the carotid pulse can be found?,In front of the ears and just above eye level,In the antecubital space,In the middle of the groin,On the anterior side of the neck,D,True,0.24999022481529784,0.2500083445754569,0.2499892711800897,0.25001215942915556
"In the brain stem, pathways for:",nociception decussate in the medial lemniscus,skilled movements decussate in the medial lemniscus,skilled motor movements decussate in the pyramids.,discriminative touch decussate in the pyramids.,C,False,0.2500023841776055,0.2500023841776055,0.24999475482673017,0.25000047681805887
The respiratory tract is crossed by the isthmus of the thyroid gland at the level of the,thyroid cartilage.,cricothyroid membrane.,cricoid cartilage.,tracheal rings.,D,False,0.25001001355485286,0.2500014302895594,0.2499823574216903,0.25000619873389734
You notice a lesion on the labial alveolar mucosa of the lower right lateral incisor tooth of one of your patients and decide to take a biopsy to send for oral pathology report Which nerve would require local anaesthesia in order to carry out a pain-free biopsy?,The incisive nerve,The mental nerve,The buccal nerve,The lingual nerve,B,False,0.25000524522965833,0.2499938011596899,0.2500014304814612,0.24999952312919063
The major concentrations of proprioceptive receptors providing information about position of the TMJ are located in,the capsule and ligaments of the TMJ and the medial pterygoid muscle.,the capsule and ligaments of the TMJ and the lateral pterygoid muscle.,the articular disc of the TMJ and the medial pterygoid muscle.,the articular disc of the TMJ and the lateral pterygoid muscle.,B,False,0.24999904630385583,0.2500009536524885,0.25000476839340974,0.249995231650246
Which of the following is a substance that aids the transmission of nerve impulses to the muscles?,Acetylcholine,Cholecystokinin,Deoxyribose,Oxytocin,A,True,0.2500603179621198,0.2500488713711794,0.25000213656260584,0.24988867410409488
"In the spinal cord, motor neuron cell bodies are located in",Lamina I.,Lamina II.,Lamina V.,Lamina IX,D,True,0.25001764227539786,0.24996042432674143,0.24999475352438538,0.2500271798734754
"When you examine a patient who has suffered an unfavourable fracture of the body of the mandible, you would expect the",anterior fragment to be displaced downwards by the action of the digastric muscle.,posterior fragment to be displaced anteriorly by the action of the lateral pterygoid muscle.,anterior fragment to be displaced backwards by action of the temporalis muscle.,posterior fragment to be displaced medially by action of the medial pterygoid muscle.,A,False,0.2499899865060814,0.25000143040142486,0.2500109673810567,0.2499976157114369
Examination of a patient indicates that they have a medially directed strabismus (squint). This could be due to damage to the,oculomotor nerve.,trochlear nerve.,ophthalmic trigeminal nerve.,abducens nerve.,D,True,0.24999713898432677,0.2500009536670404,0.2499990463184077,0.2500028610302251
"A patient cuts a peripheral motor nerve in their wrist when they fall through a plate glass window. If the nerve does not regenerate, after about 6 months the muscles it normally innervates will show signs of which of the four options below?",spastic paralysis,flaccid paralysis,atrophy,contracture,C,True,0.25000047681442084,0.25000047681442084,0.2500042915480661,0.24999475482309222
A patient suffers a CVA in the area of the left internal capsule conveying motor neurons to the right leg. The patient's leg will exhibit,spastic paralysis.,flaccid paralysis.,tremor.,hyporeflexia.,A,True,0.25000381470090344,0.24999999997453423,0.2499942779941195,0.2500019073304428
The crown of a very carious tooth suddenly fractures while the patient is standing eating at a take-away food outlet and a fragment is inhaled. It is more likely to enter the,right lung because the right main bronchus is wider and more vertical than the left.,left lung because the left main bronchus is wider and more vertical than the right.,right lung or left lung because the two main bronchi are of equal size and at the same angulation.,right or left lung because there are no factors predisposing to the fragment going in one particular direction.,A,False,0.2499976153831183,0.2500138282175494,0.24997663562864023,0.250011920770692
"Calcium, potassium, and sodium are classified as which of the following?",Androgens,Catecholamines,Electrolytes,Estrogens,C,True,0.2499971389734129,0.2500009536561264,0.25000476839704777,0.2499971389734129
Noradrenaline is the neurotransmitter between which of the two structures below?,parasympathetic pre- and post-ganglionic neurons,sympathetic pre- and post-ganglionic neurons,parasympathetic post-ganglionic neurons and target organs,sympathetic post-ganglionic neurons and target organs,D,True,0.24998664859959827,0.25000953660854874,0.24998855585364357,0.2500152589382094
Which of the following are mucus-producing glands located on each side of the vaginal opening?,Adrenal,Bartholin's,Bulbourethral,Corpus luteum,B,False,0.2500200268841256,0.25000476733840826,0.25001430444533657,0.2499609013321296
"When an emergency opening into the airway is required, the cricothyroid membrane should be pierced immediately",superior to the thyroid cartilage.,inferior to the thyroid cartilage.,inferior to the cricoid cartilage.,superior to the thyroid isthmus.,B,True,0.25000047632965244,0.25002527313880224,0.24998235713975728,0.249991893391788
Cerebrospinal fluid circulates around the brain between the,skull and dura mater.,dura mater and arachnoid mater.,arachnoid and pia maters.,pia mater and brain surface.,C,True,0.25002729826222625,0.24996435680817744,0.2500377900453122,0.24997055488428416
