0,1,2,3,4,5,correct,choiceA_probs,choiceB_probs,choiceC_probs,choiceD_probs
Which of the following closes and seals off the lower airway during swallowing?,Alveoli,Epiglottis,Larynx,Uvula,B,True,0.2500238371678926,0.25007725372708073,0.24995136151551492,0.24994754758951168
Which orbital wall is most likely to collapse in a 'blow out' fracture?,The roof,The floor,The lateral wall,The medial wall,B,False,0.2500280151338448,0.24999606550562786,0.24997937702479092,0.24999654233573634
The walls of the maxillary sinus are sinus is related to,the floor of the orbit.,the floor of the orbit and the upper posterior teeth.,"the floor of the orbit, the upper posterior teeth and the infratemporal fossa.","the floor of the orbit, the upper posterior teeth, the infratemporal fossa and the hard palate.",C,False,0.24999690056370136,0.25000262260414263,0.24999785422801335,0.25000262260414263
Which of one of the following statements about the postnatal growth of the maxilla is correct?,Pneumatisation by enlargement of the developing maxillary sinus ceases at puberty,Space is created for the eruption of the permanent molars by resorption of the maxillary tuberosity,The zygomaticomaxillary sutures contribute to increase in height and length of the maxilla,The intermaxillary suture closes about eight years postnatally,C,False,0.25001335164779187,0.24999237057272933,0.24999237057272933,0.25000190720674953
The seventh cranial nerve supplies,taste buds on the posterior third of the tongue.,muscles of the soft palate.,muscles of the lower lip.,the parotid salivary gland.,C,False,0.2500066756874715,0.24998760241942547,0.24999904620563165,0.2500066756874715
Which of the following paranasal sinuses open into the middle meatus?,The anterior ethmoidal sinuses,The anterior ethmoidal and frontal sinuses,"The anterior ethmoidal, frontal and maxillary sinuses","The anterior ethmoidal, frontal, maxillary and sphenoidal sinuses",C,True,0.24996018308802692,0.2499487410807924,0.2500460148396052,0.2500450609915754
"Which of the following is a structural, fibrous protein found in the dermis?",Collagen,Heparin,Lipocyte,Melanin,A,False,0.24994516512973794,0.2500205002266012,0.25006819240066497,0.24996614224299585
Palatine shelf elevation is due to the effect of,descent of the tongue.,changes in flexure of the developing brain.,hydrophilic molecules increasing turgor pressure in the palatine shelves.,a combination of these three processes.,D,True,0.2500042915116857,0.24999284748537398,0.24999666210260404,0.25000619890033626
On which surfaces of the teeth is dental plaque most likely to accumulate in the mouth of a patient with poor oral hygiene?,The palatal surfaces of the upper molars and lingual surfaces of the lower incisors.,The buccal surfaces of the upper molars and lingual surfaces of the lower incisors.,The palatal surfaces of the upper molars and labial surfaces of the lower incisors.,The buccal surfaces of the upper molars and labial surfaces of the lower incisors.,B,False,0.2500090600105972,0.24999570844283922,0.24999952310372436,0.24999570844283922
Laryngeal oedema is usually confined to the larynx above the vocal folds because,there are numerous mucous glands in the vestibular folds.,the mucosa covering the vocal folds is tightly attached to underlying tissues.,fluid will drain rapidly into the thorax below the vocal folds.,the mucosa above the vocal folds is more vascular than that below the vocal folds.,B,False,0.2499909401813067,0.25000524518691136,0.2500061988830556,0.24999761574872628
The coronary arteries,arise from the arch of the aorta and fill during diastole.,arise from the ascending aorta and fill during systole.,arise from the arch of the aorta and fill during systole.,arise from the ascending aorta and fill during diastole.,D,True,0.2500014304996511,0.24999952314738044,0.24999570848649463,0.2500033378664738
Which muscle is the most active during a right lateral excursion of the mandible?,Left lateral pterygoid muscle,Right lateral pterygoid muscle,Left medial pterygoid muscle,Right medial pterygoid muscle,A,False,0.24999117859420125,0.25000834471552397,0.2499997615075246,0.25000071518275024
The phrenic nerves innervate the,diaphragm.,diaphragm and parietal pleura.,"diaphragm, parietal pleura and pericardium.","diaphragm, parietal pleura, pericardium and intercostals muscles.",C,False,0.2500004767744033,0.25000619889669845,0.2500023841339496,0.2499909401949487
Parasympathetic preganglionic nerves leave the central nervous system with the,third cranial nerves.,fourth cranial nerves.,fifth cranial nerves.,sixth cranial nerves.,A,False,0.24999356273087925,0.25000691418404075,0.25000214572605683,0.2499973773590232
"In a patient with a normal healthy mouth, you would expect the mucosa covering the alveolar process supporting the mandibular teeth to be",light pink in colour on both sides of the mucogingigival junction.,light pink below the mucogingival junction and red above it.,red below the mucogingival junction and light pink above it.,red on both sides of the mucogingival junction.,C,False,0.24998617080844496,0.24996519201439352,0.2500224110544119,0.25002622612274966
Macrostomia results from failure of fusion of,maxillary and mandibular processes.,left and right mandibular processes.,maxillary and frontonasal processes.,mandibular and hyoid arches.,A,True,0.25000858314160634,0.24999904625292432,0.24999141700391278,0.25000095360155655
You suspect that your patient has an enlarged submandibular salivary gland. You expect the enlarged gland,to be palpable intraorally..,to be palpable extraorally.,to be palpable both intra- and extraorally.,only to be detectable by radiographical examination.,C,False,0.24999189385107498,0.25000143046690937,0.25000143046690937,0.2500052452151063
Osteoclasts,deposit bone and differentiate from periosteal mesenchymal cells.,resorb bone and differentiate from periosteal mesenchymal cells.,deposit bone and differentiate from monocytes.,resorb bone and differentiate from monocytes.,D,True,0.2500064819634546,0.2499885709449239,0.24999670673937252,0.25000824035224906
The lateral pterygoid muscle,is attached to the coronoid process and elevates the mandible.,is attached to the condylar process and elevates the mandible.,is attached to the coronoid process and protrudes the mandible.,is attached to the condylar process and protrudes the mandible.,D,False,0.2500154970455069,0.2500135895859174,0.2499706755923151,0.2500002377762605
"In the fetus, the ductus arteriosus passes blood from the",pulmonary vein to the aorta.,aorta to pulmonary vein.,pulmonary artery to the aorta.,aorta to the pulmonary artery.,C,True,0.24999809257860853,0.24999046335870043,0.2500057220313455,0.2500057220313455
Which of the following bones develop by endochondral ossification?,The ribs,The ribs and sternum,"The ribs, sternum and clavicle","The ribs, sternum, clavicle and vertebrae",B,False,0.24995064970329364,0.24999546756570648,0.2500030969383332,0.2500507857926666
The mucosa of the hard palate is,keratinised and has submucosa and minor salivary glands posterolaterally.,non-keratinised and has submucosa and minor salivary glands posteromedially.,keratinised and lacks submucosa and minor salivary glands.,non-keratinised and lacks submucosa and minor salivary glands.,A,True,0.25002777605309046,0.2499772308083521,0.24997293970161832,0.250022053436939
The head of the sixth rib articulates with,The inferior articular facet of T5 and superior articular facet of T6.,The inferior articular demifacet of T5 and superior articular facet of T6.,The inferior articular demifacet of T5 and the superior articular demifacet of T6.,The superior and inferior demifacets of T6.,C,False,0.250000834380841,0.25001037133773596,0.24999463555394733,0.2499941587274757
Which of the following is located beneath the diaphragm in the left upper quadrant of the abdominal cavity?,Appendix,Duodenum,Spleen,Pancreas,C,False,0.2500138264021798,0.2500338554726787,0.2500081041053068,0.24994421401983466
Proprioceptive nerve endings in synovial joints are located in,articular cartilage and synovial membrane.,synovial membrane and capsule.,capsule and ligaments.,ligaments and articular discs.,D,False,0.24998950959707614,0.2500047682115065,0.25001430531846813,0.2499914168729492
The thoracic cage is a structural unit important for which of the following functions?,Alimentation,Menstruation,Mentation,Respiration,D,False,0.2500042915116857,0.25000619890033626,0.24999284748537398,0.24999666210260404
A patient is admitted after a head injury and sinks rapidly into a coma. An MRI scan indicates an extradural haemorrhage because extravasated blood can be detected between the,skull bones and dura mater.,dura mater and arachnoid.,arachnoid and pia mater.,pia mater and brain surface.,A,True,0.25000333785192175,0.25000333785192175,0.24999952313282864,0.2499938011633278
A successful infraorbital nerve block will produce anaesthesia of the,maxillary anterior teeth.,maxillary anterior teeth and their labial gingivae.,"maxillary anterior teeth, their labial gingivae and the upper lip.","maxillary anterior teeth, their labial gingivae, the upper lip and anterior hard palate.",C,False,0.24999332433435506,0.2500009536415746,0.2500009536415746,0.2500047683824957
Which of the following foramina pierce the sphenoid bone?,The foramen ovale,The foramen ovale and rotundum,"The foramen ovale, rotundum and spinosum","The foramen ovale, rotundum and spinosum and foramen lacerum",C,False,0.249996181592774,0.25007153206633065,0.2499608986720528,0.2499713876688426
Which of the following is a disorder characterized by uncontrollable episodes of falling asleep during the day?,Dyslexia,Epilepsy,Hydrocephalus,Narcolepsy,D,False,0.2500274191304342,0.2499940390969183,0.24999022451971184,0.2499883172529357
Which of the following allows gas exchange in the lungs?,Alveoli,Bronchi,Bronchioles,Capillaries,A,False,0.25000071306176813,0.25005030918655385,0.24995780127837797,0.24999117647330008
"A patient has a fracture in which the radius is bent but not displaced, and the skin is intact. This type of fracture is known as which of the following?","Closed, greenstick","Complex, comminuted","Compound, transverse","Open, spiral",A,False,0.25000190733771877,0.2499980926404534,0.25000381470817945,0.24999618531364845
Fertilization of an ovum by a spermatozoon occurs in which of the following structures?,Cervix,Fallopian tube,Ovary,Uterus,B,False,0.24999332432344132,0.2500009536306605,0.24999904628202804,0.2500066757638702
Ectoderm gives rise to,the neural tube.,ectomesenchymal cells.,dental enamel.,all three structures.,D,False,0.24998903249981244,0.24998235716158723,0.2500224118648308,0.2500061984737695
"In men, which of the following structures is located at the neck of the bladder and surrounds the urethra?",Epididymis,Prostate,Scrotum,Seminal vesicle,B,True,0.2500019072904251,0.2500057220458979,0.24999046337325187,0.2500019072904251
"Which of the following options completes the following statement? ""The right atrioventricular valve…""",is a semilunar valve,is prevented from everting by papillary muscles.,is open during systole.,prevents blood returning from the pulmonary trunk as the heart relaxes.,B,False,0.25003623821478715,0.24994182860017383,0.24997138737259875,0.2500505458124403
Which one of the following brain areas is supplied by branches of the subclavian arteries?,The frontal lobe,The parietal lobe,The hypothalamus,The cerebellum,D,True,0.2500030993869584,0.2499897481375236,0.2500016688618417,0.2500054836136763
Which of the following structures is part of the small intestine?,Ascending colon,Cecum,Ileum,Sigmoid colon,C,False,0.25007367686355614,0.24999641841515505,0.2500021404445607,0.2499277642767282
During an inferior alveolar nerve block the needle ideally passes,posterior and medial to medial pterygoid.,anterior and lateral to medial pterygoid.,through medial pterygoid.,inferior to medial pterygoid.,B,False,0.2500345699768547,0.24993730067036168,0.2500326623717508,0.24999546698103278
Patients with which of the following diseases are treated with injections of vitamin B-12?,Bell's palsy,Crohn's disease,Pernicious anemia,Graves' disease,C,False,0.24998903289633848,0.25000715257010503,0.2500023841075743,0.2500014304259822
Which of the following bones has a process that joins with the zygomatic bone to form the zygomatic arch?,The maxillary bone,The temporal bone,The sphenoid bone,The frontal bone,B,False,0.24995303383629827,0.2499940374908142,0.2500092963816137,0.2500436322912739
Parasympathetic preganglionic axons leave the CNS with the,cervical spinal nerves.,thoracic spinal nerves.,lumbar spinal nerves.,sacral spinal nerves.,D,False,0.25003337993526836,0.24999236982786255,0.24997520480341065,0.24999904543345836
A patient with damage to their cervical sympathetic chain will show the following signs and symptoms.,Pupillary constriction,Pupillary constriction and vasodilation of facial vessels,"Pupillary constriction, vasodilation of facial vessels and increased facial sweating","Pupillary constriction, vasodilation of facial vessels, increased facial sweating and decreased lacrimation",B,False,0.24999189381833406,0.2500052451823636,0.25000715257829015,0.2499957084210122
Which of the following cranial nerves is related to the sense of smell?,Abducens,Hypoglossal,Olfactory,Trochlear,C,False,0.2500071507592872,0.2500033359820142,0.24995184218561678,0.25003767107308184
Where are the vital centres located in the brainstem?,midbrain,pons,medulla oblongata,cerebellum,C,False,0.250000476268724,0.2500233655436933,0.250000476268724,0.24997568191885863
Saliva contains an enzyme that acts upon which of the following nutrients?,Starches,Proteins,Fats,Minerals,A,True,0.25001859628533774,0.2499623316471551,0.25001859628533774,0.2500004757821694
During swallowing the,auditory tube opens.,cricopharyngeus muscle contracts.,rima glottis opens.,gag reflex is suspended.,A,False,0.2499904633041322,0.2500114442191237,0.24999427788498224,0.250003814591762
The dorsal roots of all spinal nerves contain,sensory neuronal processes.,sensory and autonomic neuronal processes.,motor neuronal processes.,motor and autonomic neuronal processes.,A,False,0.24998569511444974,0.25000095349605544,0.2500123978934394,0.25000095349605544
Which of the following is the master gland of the endocrine system?,Adrenal,Pancreas,Pineal,Pituitary,D,True,0.24994206776687813,0.2499849768492002,0.2500259857438217,0.25004696964010004
Loss of somatic sensation over the anterior two-thirds of the tongue indicates damage to the,lingual branch of the mandibular trigeminal nerve.,chorda tympani branch of the facial nerve.,lingual branch of the glossopharyngeal nerve.,hypoglossal nerve.,A,False,0.24997854225334884,0.25003290293347763,0.2500081053676261,0.2499804494455474
"In men, specimens for gonococcal cultures are most commonly obtained from which of the following structures?",Anus,Bladder,Urethra,Testicle,C,False,0.24999952315829432,0.25000143051056506,0.24999761582057545,0.25000143051056506
Which of the following structures should be visible on a dental panoramic radiograph?,The mandibular canal,The mandibular canal and maxillary sinus,"The mandibular canal, maxillary sinus and hard palate","The mandibular canal, maxillary sinus, hard palate and zygomatic arch",D,True,0.2500114405819086,0.24999141330696423,0.24993801508330968,0.2500591310278175
